{
  "$schema": "https://json-schema.org/draft/2020-12/schema",
  "title": "Codex turn and live draft transactions",
  "type": "object",
  "additionalProperties": false,
  "required": [
    "schema_version",
    "action_id",
    "project_id",
    "thread_id",
    "turn_id",
    "model",
    "instruction",
    "status",
    "started_at",
    "events",
    "transactions"
  ],
  "properties": {
    "schema_version": {
      "type": "string",
      "const": "1.0"
    },
    "action_id": {
      "type": "string",
      "pattern": "^[A-Za-z0-9][A-Za-z0-9._-]{1,127}$"
    },
    "project_id": {
      "type": "string",
      "pattern": "^[A-Za-z0-9][A-Za-z0-9._-]{1,127}$"
    },
    "thread_id": {
      "type": "string",
      "minLength": 1,
      "maxLength": 256
    },
    "turn_id": {
      "type": "string",
      "minLength": 1,
      "maxLength": 256
    },
    "model": {
      "type": "string",
      "minLength": 1,
      "maxLength": 200
    },
    "instruction": {
      "type": "string",
      "minLength": 1,
      "maxLength": 20000
    },
    "status": {
      "enum": [
        "queued",
        "running",
        "awaiting_approval",
        "interrupted",
        "complete",
        "failed"
      ]
    },
    "started_at": {
      "type": "string",
      "pattern": "^\\d{4}-\\d{2}-\\d{2}T\\d{2}:\\d{2}:\\d{2}(?:\\.\\d+)?Z$"
    },
    "ended_at": {
      "type": [
        "string",
        "null"
      ],
      "pattern": "^\\d{4}-\\d{2}-\\d{2}T\\d{2}:\\d{2}:\\d{2}(?:\\.\\d+)?Z$"
    },
    "skill_names": {
      "type": "array",
      "items": {
        "type": "string",
        "minLength": 1
      },
      "uniqueItems": true
    },
    "events": {
      "type": "array",
      "items": {
        "type": "object",
        "additionalProperties": false,
        "required": [
          "sequence",
          "kind",
          "at",
          "summary"
        ],
        "properties": {
          "sequence": {
            "type": "integer",
            "minimum": 0
          },
          "kind": {
            "enum": [
              "status",
              "message",
              "tool_started",
              "tool_completed",
              "draft_changed",
              "approval_requested",
              "warning",
              "error"
            ]
          },
          "at": {
            "type": "string",
            "pattern": "^\\d{4}-\\d{2}-\\d{2}T\\d{2}:\\d{2}:\\d{2}(?:\\.\\d+)?Z$"
          },
          "summary": {
            "type": "string",
            "maxLength": 500
          }
        }
      }
    },
    "transactions": {
      "type": "array",
      "items": {
        "type": "object",
        "additionalProperties": false,
        "required": [
          "transaction_id",
          "tool_name",
          "status",
          "operation_ids"
        ],
        "properties": {
          "transaction_id": {
            "type": "string",
            "pattern": "^[A-Za-z0-9][A-Za-z0-9._-]{1,127}$"
          },
          "tool_name": {
            "type": "string",
            "minLength": 1,
            "maxLength": 160
          },
          "status": {
            "enum": [
              "proposed",
              "validated",
              "applied",
              "rejected",
              "failed",
              "undone"
            ]
          },
          "operation_ids": {
            "type": "array",
            "items": {
              "type": "string",
              "pattern": "^[A-Za-z0-9][A-Za-z0-9._-]{1,127}$"
            }
          },
          "error_code": {
            "type": [
              "string",
              "null"
            ],
            "maxLength": 100
          }
        }
      }
    }
  }
}
